{
  "schema_version": "1.0",
  "_id": "66666666-6666-4666-8666-666666666661",
  "seller_id": "019997c0-0000-7000-8000-000000000002",
  "source": {
    "source_id": "catalog_ua_rozetka",
    "source_item_id": "seller-42"
  },
  "contacts": [
    {
      "kind": "phone",
      "raw": "044 000-00-00",
      "normalized": "+380440000000"
    },
    {
      "kind": "email",
      "raw": "Seller@Example.com",
      "normalized": "seller@example.com"
    }
  ],
  "observed_at": "2026-09-01T11:59:00Z",
  "projection_version": 1,
  "projection_task_id": "11111111-1111-4111-8111-111111111111",
  "lineage": {
    "fetch_id": "22222222-2222-4222-8222-222222222222",
    "raw_sha256": "bbbbbbbbbbbbbbbbbbbbbbbbbbbbbbbbbbbbbbbbbbbbbbbbbbbbbbbbbbbbbbbb",
    "parser_version": "catalog-parser/1.0.0",
    "projection_task_id": "11111111-1111-4111-8111-111111111111"
  }
}
